{
  "cosmolang": "0.1",
  "request_id": "example-2",
  "context": {
    "graph": "research-graph",
    "snapshot": "snapshot-42",
    "projection": "projection-v1",
    "hierarchy": "spatial-h1",
    "layout": "layout-v1",
    "selection": null
  },
  "budget": {
    "max_points": 50000,
    "max_links": 200000,
    "max_wire_bytes": "33554432",
    "max_decoded_bytes": "134217728",
    "max_scan_edges": "1000000",
    "max_scan_bytes": "268435456",
    "max_working_bytes": "536870912",
    "deadline_ms": 2000
  },
  "command": {
    "op": "session.sync",
    "params": {}
  },
  "session_id": "session-1",
  "expect_revision": "7"
}
